{
  "$schema": "http://json-schema.org/draft-07/schema#",
  "$comment": "GENERATED by gui/schema-gen/derive_nf_config_schemas.py from config/li-mdf3.json + its source (ADR-0425). Do not edit; regenerate.",
  "title": "li-mdf3",
  "type": "object",
  "additionalProperties": false,
  "properties": {
    "x1_port": {
      "type": "integer",
      "x-env-override": "LI_MDF3_X1_PORT",
      "x-cpp-type": "std::uint16_t"
    },
    "x2x3_port": {
      "type": "integer",
      "x-env-override": "LI_MDF3_X2X3_PORT",
      "x-cpp-type": "std::uint16_t"
    },
    "metrics_bind_address": {
      "type": "string",
      "x-env-override": "LI_MDF3_METRICS_BIND_ADDRESS",
      "x-cpp-type": "std::string"
    },
    "redis_url": {
      "type": "string",
      "x-env-override": "LI_MDF3_REDIS_URL",
      "x-cpp-type": "std::string"
    },
    "ne_identifier": {
      "type": "string",
      "x-env-override": "LI_MDF3_NE_IDENTIFIER",
      "x-cpp-type": "std::string"
    },
    "network_identifier": {
      "type": "object",
      "additionalProperties": false,
      "properties": {
        "operator_identifier": {
          "type": "string"
        },
        "network_element_identifier": {
          "type": "string"
        }
      }
    },
    "delivery_country_code": {
      "type": "string"
    },
    "authorization_country_code": {
      "type": "string"
    },
    "interception_point_id": {
      "type": "string"
    },
    "x2x3": {
      "type": "object",
      "additionalProperties": false,
      "properties": {
        "bind_address": {
          "type": "string"
        },
        "max_pdu_bytes": {
          "type": "integer"
        }
      }
    },
    "x1_keepalive": {
      "type": "object",
      "additionalProperties": false,
      "properties": {
        "time_p2_seconds": {
          "type": "integer"
        },
        "time_p1_seconds": {
          "type": "integer"
        },
        "time_p3_seconds": {
          "type": "integer"
        },
        "allow_deactivate_all": {
          "type": "boolean"
        }
      }
    },
    "hi3": {
      "type": "object",
      "additionalProperties": false,
      "properties": {
        "reconnect_interval_seconds": {
          "type": "integer"
        },
        "keepalive_time1_seconds": {
          "type": "integer"
        },
        "keepalive_time3_seconds": {
          "type": "integer"
        },
        "buffer_capacity_bytes": {
          "type": "integer"
        },
        "sni": {
          "type": "string"
        }
      }
    },
    "cc_pdu_form": {
      "type": "string"
    }
  },
  "required": [
    "metrics_bind_address",
    "ne_identifier",
    "redis_url",
    "x1_port",
    "x2x3_port"
  ],
  "x-config-file": "config/li-mdf3.json",
  "x-source": [
    "nfs/li-mdf3"
  ],
  "x-apply": "restart",
  "x-review": [
    "network_identifier: nested object shape inferred from current values (map-vs-struct meaning unverified; new keys refused until reviewed)",
    "x2x3: nested object shape inferred from current values (map-vs-struct meaning unverified; new keys refused until reviewed)",
    "x1_keepalive: nested object shape inferred from current values (map-vs-struct meaning unverified; new keys refused until reviewed)",
    "hi3: nested object shape inferred from current values (map-vs-struct meaning unverified; new keys refused until reviewed)"
  ]
}
